{
  "$schema": "https://json-schema.org/draft/2020-12/schema",
  "$id": "https://somdet.net/schemas/thai-law-universal/v0.2",
  "title": "Matra — Thai Law Universal Schema v0.2 (มาตรฐานกลาง)",
  "description": "One standard for every Thai legal document type: codes, acts, secondary legislation, with TOC hierarchy, amendment timeline, cross-references, deka links, and annex/table support. v0.2 = v0.1 (grounded in real ocs-krisdika Criminal Code -63, 1031 sections + standard legal note schema) MERGED with Block-based/OLAW patterns (external standards profile, 2026-06/07): flattened polymorphic blocks, hierarchy_path embedding, VIGUEUR-style status gate, 3-tier validation flags, Hybrid-RAG routing metadata. Display may pivot per doc type; THIS standard never changes per law.",
  "type": "object",
  "required": ["doc_id", "doc_type", "title", "status", "timeline", "structure", "provenance", "schema_version"],
  "properties": {
    "schema_version": { "const": "0.2" },
    "doc_id": { "type": "string", "description": "Stable ID. Reuse Krisdika law_code+timeline (e.g. 'ป0006-1D-0003-63') so existing Krisdika-derived URLs keep working." },
    "doc_type": { "enum": ["code", "enacting_act", "act", "royal_decree", "emergency_decree", "ministerial_regulation", "announcement", "order", "regulation", "bylaw", "interpretation", "deka", "article", "form", "manual"], "description": "ประมวล / พ.ร.บ.ให้ใช้ (SPLIT from code per spec) / พ.ร.บ. / พ.ร.ฎ. / พ.ร.ก. / กฎกระทรวง / ประกาศ / คำสั่ง / ระเบียบ / ข้อบังคับ / เอกสารตีความ / ฎีกา / บทความ / แบบฟอร์ม / คู่มือ" },
    "title": {
      "type": "object",
      "properties": {
        "th": { "type": "string" },
        "en": { "type": ["string", "null"] },
        "machine_translated": { "type": ["boolean", "null"], "description": "REQUIRED true whenever en text is machine-translated; provenance honesty" }
      },
      "required": ["th"]
    },
    "status": { "enum": ["in_force", "pending", "repealed"], "description": "บังคับใช้อยู่ / รอมีผลใช้บังคับ / ยกเลิก — REQUIRED on every doc (core requirement of the standard)" },
    "status_evidence": { "type": "string", "description": "How status was determined (source + date). Never asserted without evidence." },
    "timeline": {
      "type": "object",
      "description": "Fixes broken is_latest. Ordering derives from timeline_seq, newest first for display.",
      "properties": {
        "law_group_code": { "type": "string", "description": "e.g. 'ป0006-1D-0003' — groups all versions" },
        "timeline_seq": { "type": "integer", "description": "e.g. 63 — authoritative recency within group" },
        "is_latest_computed": { "type": "boolean", "description": "Computed = max(timeline_seq) in group. NOT the source field (broken upstream)." },
        "amended_by": { "type": "array", "items": {"type": "string"}, "description": "doc_ids of amendment acts, newest→oldest" },
        "consolidates": { "type": "array", "items": {"type": "string"} }
      },
      "required": ["law_group_code", "timeline_seq", "is_latest_computed"]
    },
    "structure": {
      "type": "array",
      "description": "Ordered tree nodes. TOC is GENERATED from this (source สารบาญ discarded as corrupted).",
      "items": {
        "type": "object",
        "required": ["node_id", "node_type", "order"],
        "properties": {
          "node_id": { "type": "string" },
          "node_type": { "enum": ["phak", "laksana", "muad", "suan", "bot", "matra", "kho", "paragraph", "preamble", "promulgation", "recital", "countersign", "remark", "annex", "table", "glossary_term"], "description": "ภาค/ลักษณะ/หมวด/ส่วน/บท/มาตรา/ข้อ/วรรค + annex & table nodes (laws with แนบท้าย/ตาราง supported natively)" },
          "krisdika_type_id": { "type": ["integer","null"], "description": "Original sectionTypeId for lineage (6=ภาค 7=ลักษณะ 8=หมวด 9=ส่วน 4=มาตรา 10=ข้อ 14=countersign 15=remark 16=source-TOC)" },
          "number": { "type": ["string","null"], "description": "'๙๐/๑' style kept verbatim; arabic mirror in number_arabic" },
          "number_arabic": { "type": ["string","null"] },
          "heading": { "type": ["string","null"] },
          "parent_id": { "type": ["string","null"], "description": "Tree link → TOC ภาค>ลักษณะ>หมวด>ส่วน>มาตรา generated by walk" },
          "hierarchy_path": { "type": ["string","null"], "description": "Precomputed human path e.g. 'ประมวลกฎหมายอาญา > ภาค ๑ > ลักษณะ ๑ > หมวด ๑' — prepended before embedding (OLAW context-aware pattern) and rendered as breadcrumb" },
          "order": { "type": "integer" },
          "review_flag": { "type": "object", "description": "3-tier validation output (part of the standard): schema check hard-fails the run; this flag marks soft uncertainty for targeted human review", "properties": { "flagged": {"type":"boolean"}, "reason": {"type":["string","null"]}, "ai_confidence": {"type":["number","null"]} } },
          "display": { "type": "boolean", "description": "false for countersign (ผู้รับสนอง) and remark (หมายเหตุ) per standard display policy — kept in DB, hidden on web" },
          "status": { "enum": ["in_force", "pending", "repealed", "unknown"], "default": "unknown", "description": "Per-มาตรา status — a section can be repealed while its code stands (COLD etat pattern)" },
          "status_evidence": { "type": ["string", "null"] },
          "effective_from": { "type": ["string", "null"], "format": "date" },
          "effective_until": { "type": ["string", "null"], "format": "date" },
          "matra_cid": { "type": ["string", "null"], "description": "{law_group_code}:{number_arabic} — stable across amendment versions" },
          "eId": { "type": ["string", "null"], "description": "AKN-style ASCII structural id (e.g. 'art_135_1', 'part_2__title_1_1'); recomputed per expression. Task 6′." },
          "wId": { "type": ["string", "null"], "description": "= eId at first assignment (v0 contract). Frozen across renumbering once divergence is implemented (post-v0). Task 6′." },
          "application_scope": {
            "type": "array",
            "description": "Phased/retroactive/geographic application — single date pair is the common case, this is the escape hatch",
            "items": {
              "type": "object",
              "required": ["condition"],
              "properties": {
                "condition": { "type": "string" },
                "area": { "type": ["string", "null"] },
                "from": { "type": ["string", "null"] },
                "until": { "type": ["string", "null"] }
              }
            }
          },
          "paragraphs": {
            "type": "array",
            "description": "วรรค of a มาตรา, in order. Formatting preserved to match searchlaw.ocs.go.th rendering (standard formatting reference).",
            "items": { "type": "object", "properties": { "text": {"type":"string"}, "indent": {"type":"integer"}, "list_marker": {"type":["string","null"]} }, "required": ["text"] }
          },
          "table": { "type": ["object","null"], "description": "For ตาราง/บัญชีแนบท้าย: {caption, columns[], rows[][], colspan map}. Universal container so table-laws need no schema change." },
          "refs_out": { "type": "array", "items": { "type": "object", "properties": { "target_doc": {"type":"string"}, "target_matra": {"type":["string","null"]}, "raw_text": {"type":"string"} } }, "description": "กฎหมายอ้างกฎหมาย (มาตรา X แห่ง พ.ร.บ. Y)" },
          "deka_refs": { "type": "array", "items": {"type": "string"}, "description": "ฎีกา ids attached at law level AND matra level (navigation requirement)" }
        }
      }
    },
    "completeness": {
      "type": "object",
      "description": "Additive v0.2 — มาตรา coverage of a consolidated code, so consumers (Stream A) can show honestly and nothing is dropped silently. present/min/max/contiguous/gaps describe the navigable CODE BODY (main doc) base มาตรา numbers (ทวิ/ตรี share a base). present_in_corpus counts base numbers anywhere in the law's records. gaps_absent = base numbers truly missing from the corpus (a real, declared coverage gap). gaps_unmerged = base numbers present in the corpus but not yet merged into the code body (merge-engine limit, NOT missing data). assembled/assembly_sources flag codes consolidated across records (e.g. the Civil & Commercial Code's 6 บรรพ).",
      "properties": {
        "present": { "type": "integer" },
        "min": { "type": ["integer", "null"] },
        "max": { "type": ["integer", "null"] },
        "contiguous": { "type": "boolean" },
        "gaps": { "type": "array", "items": { "type": "array", "items": { "type": "integer" } } },
        "present_in_corpus": { "type": "integer" },
        "gaps_unmerged": { "type": "array", "items": { "type": "integer" } },
        "gaps_absent": { "type": "array", "items": { "type": "integer" } }
      }
    },
    "flat_profile": {
      "type": "object",
      "description": "Documents the flat export (1 row = 1 มาตรา, generated from tree). Not required — descriptor for the export produced by later pipeline tasks.",
      "properties": {
        "columns": {
          "const": ["matra_cid","law_group_code","doc_id","doc_type","law_title_th","phak","laksana","muad","suan","matra_no","matra_no_arabic","status","effective_from","effective_until","text","refs_out","deka_refs","reference_url","is_latest_computed"],
          "description": "Fixed column order for the flat export. const so drift fails validation."
        }
      }
    },
    "provenance": {
      "type": "object",
      "required": ["source", "reference_url", "ingested_at", "pipeline_version"],
      "properties": {
        "source": { "enum": ["ocs-krisdika", "soc-ratchakitcha", "deka-supremecourt", "agency-official", "manual"] },
        "reference_url": { "type": "string", "description": "Per-record audit link (e.g. searchlaw.ocs.go.th doc URL) — every claim checkable" },
        "source_trust_rank": { "type": "integer", "description": "1=ratchakitcha/OCS/official/deka.supremecourt · 2=openlawdata bulk · 3=community (per standard three-layer QA)" },
        "ingested_at": { "type": "string", "format": "date-time" },
        "pipeline_version": { "type": "string" },
        "qa": { "type": "object", "properties": { "auto_checks_passed": {"type":"integer"}, "auto_checks_failed": {"type":"integer"}, "check_report": {"type":"string"} }, "description": "ระบบตรวจทานอัตโนมัติ output — consumers see pass/fail per doc per standard, no manual full re-read" },
        "known_defects": { "type": "array", "items": {"type": "string"}, "description": "What is wrong/missing, not only what works (Berkson lesson — log the invisible)" }
      }
    },
    "lang": { "enum": ["th", "en"], "default": "th" },
    "en_pair_doc": { "type": ["string","null"], "description": "doc_id of English version when exists (keep TH and EN when an official translation exists)" }
  }
}
